{
  "id": "dass21",
  "name": "Depression Anxiety Stress Scales – 21 Items",
  "short_name": "DASS-21",
  "category": "mental_health",
  "description": "A 21-item self-report questionnaire designed to measure the negative emotional states of depression, anxiety, and stress over the past week.",
  "version": "Short Form (21 items)",
  "source": "Lovibond & Lovibond (1995)",
  "instructions": "Please read each statement and select how much the statement applied to you over the past week.",

  "questions": [
    {
      "id": "dass21_q1",
      "text": "I found it hard to wind down",
      "domain": "stress",
      "response_format": {
        "type": "scale",
        "scale": "likert_0_3",
        "response_key": "dass21_q1"
      }
    },
    {
      "id": "dass21_q2",
      "text": "I was aware of dryness of my mouth",
      "domain": "anxiety",
      "response_format": {
        "type": "scale",
        "scale": "likert_0_3",
        "response_key": "dass21_q2"
      }
    },
    {
      "id": "dass21_q3",
      "text": "I couldn’t seem to experience any positive feeling at all",
      "domain": "depression",
      "response_format": {
        "type": "scale",
        "scale": "likert_0_3",
        "response_key": "dass21_q3"
      }
    },
    {
      "id": "dass21_q4",
      "text": "I experienced breathing difficulty (e.g., excessively rapid breathing, breathlessness in the absence of physical exertion)",
      "domain": "anxiety",
      "response_format": {
        "type": "scale",
        "scale": "likert_0_3",
        "response_key": "dass21_q4"
      }
    },
    {
      "id": "dass21_q5",
      "text": "I found it difficult to work up the initiative to do things",
      "domain": "depression",
      "response_format": {
        "type": "scale",
        "scale": "likert_0_3",
        "response_key": "dass21_q5"
      }
    },
    {
      "id": "dass21_q6",
      "text": "I tended to over-react to situations",
      "domain": "stress",
      "response_format": {
        "type": "scale",
        "scale": "likert_0_3",
        "response_key": "dass21_q6"
      }
    },
    {
      "id": "dass21_q7",
      "text": "I experienced trembling (e.g., in the hands)",
      "domain": "anxiety",
      "response_format": {
        "type": "scale",
        "scale": "likert_0_3",
        "response_key": "dass21_q7"
      }
    },
    {
      "id": "dass21_q8",
      "text": "I felt that I was using a lot of nervous energy",
      "domain": "stress",
      "response_format": {
        "type": "scale",
        "scale": "likert_0_3",
        "response_key": "dass21_q8"
      }
    },
    {
      "id": "dass21_q9",
      "text": "I was worried about situations in which I might panic and make a fool of myself",
      "domain": "anxiety",
      "response_format": {
        "type": "scale",
        "scale": "likert_0_3",
        "response_key": "dass21_q9"
      }
    },
    {
      "id": "dass21_q10",
      "text": "I felt that I had nothing to look forward to",
      "domain": "depression",
      "response_format": {
        "type": "scale",
        "scale": "likert_0_3",
        "response_key": "dass21_q10"
      }
    },
    {
      "id": "dass21_q11",
      "text": "I found myself getting agitated",
      "domain": "stress",
      "response_format": {
        "type": "scale",
        "scale": "likert_0_3",
        "response_key": "dass21_q11"
      }
    },
    {
      "id": "dass21_q12",
      "text": "I found it difficult to relax",
      "domain": "stress",
      "response_format": {
        "type": "scale",
        "scale": "likert_0_3",
        "response_key": "dass21_q12"
      }
    },
    {
      "id": "dass21_q13",
      "text": "I felt down-hearted and blue",
      "domain": "depression",
      "response_format": {
        "type": "scale",
        "scale": "likert_0_3",
        "response_key": "dass21_q13"
      }
    },
    {
      "id": "dass21_q14",
      "text": "I was intolerant of anything that kept me from getting on with what I was doing",
      "domain": "stress",
      "response_format": {
        "type": "scale",
        "scale": "likert_0_3",
        "response_key": "dass21_q14"
      }
    },
    {
      "id": "dass21_q15",
      "text": "I felt I was close to panic",
      "domain": "anxiety",
      "response_format": {
        "type": "scale",
        "scale": "likert_0_3",
        "response_key": "dass21_q15"
      }
    },
    {
      "id": "dass21_q16",
      "text": "I was unable to become enthusiastic about anything",
      "domain": "depression",
      "response_format": {
        "type": "scale",
        "scale": "likert_0_3",
        "response_key": "dass21_q16"
      }
    },
    {
      "id": "dass21_q17",
      "text": "I felt I wasn’t worth much as a person",
      "domain": "depression",
      "response_format": {
        "type": "scale",
        "scale": "likert_0_3",
        "response_key": "dass21_q17"
      }
    },
    {
      "id": "dass21_q18",
      "text": "I felt that I was rather touchy",
      "domain": "stress",
      "response_format": {
        "type": "scale",
        "scale": "likert_0_3",
        "response_key": "dass21_q18"
      }
    },
    {
      "id": "dass21_q19",
      "text": "I was aware of the action of my heart in the absence of physical exertion",
      "domain": "anxiety",
      "response_format": {
        "type": "scale",
        "scale": "likert_0_3",
        "response_key": "dass21_q19"
      }
    },
    {
      "id": "dass21_q20",
      "text": "I felt scared without any good reason",
      "domain": "anxiety",
      "response_format": {
        "type": "scale",
        "scale": "likert_0_3",
        "response_key": "dass21_q20"
      }
    },
    {
      "id": "dass21_q21",
      "text": "I felt that life was meaningless",
      "domain": "depression",
      "response_format": {
        "type": "scale",
        "scale": "likert_0_3",
        "response_key": "dass21_q21"
      }
    }
  ],

  "metadata": {
    "estimated_time_minutes": 7,
    "clinical_use": true,
    "license": "Free for research and clinical use"
  }
}