{
  "id": "pcl5",
  "name": "Posttraumatic Stress Disorder Checklist for DSM-5",
  "short_name": "PCL-5",
  "category": "ptsd",
  "description": "A 20-item self-report measure that assesses the presence and severity of PTSD symptoms according to DSM-5 criteria.",
  "version": "DSM-5",
  "source": "Weathers et al., 2013, U.S. Department of Veterans Affairs",
  "instructions": "Keeping your worst stressful experience in mind, please indicate how much you have been bothered by each problem in the past month.",
  "questions": [
    {
      "id": "pcl5_q1",
      "text": "Repeated, disturbing, and unwanted memories of the stressful experience?",
      "response_format": {
        "type": "scale",
        "scale": "likert_0_4",
        "response_key": "value"
      }
    },
    {
      "id": "pcl5_q2",
      "text": "Repeated, disturbing dreams of the stressful experience?",
      "response_format": {
        "type": "scale",
        "scale": "likert_0_4",
        "response_key": "value"
      }
    },
    {
      "id": "pcl5_q3",
      "text": "Suddenly feeling or acting as if the stressful experience were actually happening again?",
      "response_format": {
        "type": "scale",
        "scale": "likert_0_4",
        "response_key": "value"
      }
    },
    {
      "id": "pcl5_q4",
      "text": "Feeling very upset when something reminded you of the stressful experience?",
      "response_format": {
        "type": "scale",
        "scale": "likert_0_4",
        "response_key": "value"
      }
    },
    {
      "id": "pcl5_q5",
      "text": "Having strong physical reactions when reminded of the stressful experience?",
      "response_format": {
        "type": "scale",
        "scale": "likert_0_4",
        "response_key": "value"
      }
    },
    {
      "id": "pcl5_q6",
      "text": "Avoiding memories, thoughts, or feelings related to the stressful experience?",
      "response_format": {
        "type": "scale",
        "scale": "likert_0_4",
        "response_key": "value"
      }
    },
    {
      "id": "pcl5_q7",
      "text": "Avoiding external reminders of the stressful experience?",
      "response_format": {
        "type": "scale",
        "scale": "likert_0_4",
        "response_key": "value"
      }
    },
    {
      "id": "pcl5_q8",
      "text": "Trouble remembering important parts of the stressful experience?",
      "response_format": {
        "type": "scale",
        "scale": "likert_0_4",
        "response_key": "value"
      }
    },
    {
      "id": "pcl5_q9",
      "text": "Having strong negative beliefs about yourself, others, or the world?",
      "response_format": {
        "type": "scale",
        "scale": "likert_0_4",
        "response_key": "value"
      }
    },
    {
      "id": "pcl5_q10",
      "text": "Blaming yourself or someone else for the stressful experience?",
      "response_format": {
        "type": "scale",
        "scale": "likert_0_4",
        "response_key": "value"
      }
    },
    {
      "id": "pcl5_q11",
      "text": "Having strong negative feelings such as fear, horror, anger, guilt, or shame?",
      "response_format": {
        "type": "scale",
        "scale": "likert_0_4",
        "response_key": "value"
      }
    },
    {
      "id": "pcl5_q12",
      "text": "Loss of interest in activities that you used to enjoy?",
      "response_format": {
        "type": "scale",
        "scale": "likert_0_4",
        "response_key": "value"
      }
    },
    {
      "id": "pcl5_q13",
      "text": "Feeling distant or cut off from other people?",
      "response_format": {
        "type": "scale",
        "scale": "likert_0_4",
        "response_key": "value"
      }
    },
    {
      "id": "pcl5_q14",
      "text": "Trouble experiencing positive feelings?",
      "response_format": {
        "type": "scale",
        "scale": "likert_0_4",
        "response_key": "value"
      }
    },
    {
      "id": "pcl5_q15",
      "text": "Irritable behavior, angry outbursts, or acting aggressively?",
      "response_format": {
        "type": "scale",
        "scale": "likert_0_4",
        "response_key": "value"
      }
    },
    {
      "id": "pcl5_q16",
      "text": "Taking too many risks or doing things that could cause you harm?",
      "response_format": {
        "type": "scale",
        "scale": "likert_0_4",
        "response_key": "value"
      }
    },
    {
      "id": "pcl5_q17",
      "text": "Being super-alert, watchful, or on guard?",
      "response_format": {
        "type": "scale",
        "scale": "likert_0_4",
        "response_key": "value"
      }
    },
    {
      "id": "pcl5_q18",
      "text": "Feeling jumpy or easily startled?",
      "response_format": {
        "type": "scale",
        "scale": "likert_0_4",
        "response_key": "value"
      }
    },
    {
      "id": "pcl5_q19",
      "text": "Having difficulty concentrating?",
      "response_format": {
        "type": "scale",
        "scale": "likert_0_4",
        "response_key": "value"
      }
    },
    {
      "id": "pcl5_q20",
      "text": "Trouble falling or staying asleep?",
      "response_format": {
        "type": "scale",
        "scale": "likert_0_4",
        "response_key": "value"
      }
    }
  ],
  "metadata": {
    "estimated_time_minutes": 5,
    "clinical_use": true,
    "license": "Public domain (U.S. Department of Veterans Affairs)"
  }
}