{
  "id": "phq9",
  "name": "Patient Health Questionnaire-9",
  "short_name": "PHQ-9",
  "category": "depression",
  "description": "A 9-item self-report questionnaire used to screen, diagnose, monitor, and measure the severity of depression.",
  "version": "9-item",
  "source": "Kroenke, Spitzer & Williams (1999), Pfizer Inc.",
  "instructions": "Over the last 2 weeks, how often have you been bothered by any of the following problems?",
  "questions": [
    {
      "id": "phq9_q1",
      "text": "Little interest or pleasure in doing things",
      "response_format": {
        "type": "scale",
        "scale": "likert_0_3",
        "response_key": "value"
      }
    },
    {
      "id": "phq9_q2",
      "text": "Feeling down, depressed, or hopeless",
      "response_format": {
        "type": "scale",
        "scale": "likert_0_3",
        "response_key": "value"
      }
    },
    {
      "id": "phq9_q3",
      "text": "Trouble falling or staying asleep, or sleeping too much",
      "response_format": {
        "type": "scale",
        "scale": "likert_0_3",
        "response_key": "value"
      }
    },
    {
      "id": "phq9_q4",
      "text": "Feeling tired or having little energy",
      "response_format": {
        "type": "scale",
        "scale": "likert_0_3",
        "response_key": "value"
      }
    },
    {
      "id": "phq9_q5",
      "text": "Poor appetite or overeating",
      "response_format": {
        "type": "scale",
        "scale": "likert_0_3",
        "response_key": "value"
      }
    },
    {
      "id": "phq9_q6",
      "text": "Feeling bad about yourself — or that you are a failure or have let yourself or your family down",
      "response_format": {
        "type": "scale",
        "scale": "likert_0_3",
        "response_key": "value"
      }
    },
    {
      "id": "phq9_q7",
      "text": "Trouble concentrating on things, such as reading the newspaper or watching television",
      "response_format": {
        "type": "scale",
        "scale": "likert_0_3",
        "response_key": "value"
      }
    },
    {
      "id": "phq9_q8",
      "text": "Moving or speaking so slowly that other people could have noticed, or the opposite — being so fidgety or restless that you have been moving around a lot more than usual",
      "response_format": {
        "type": "scale",
        "scale": "likert_0_3",
        "response_key": "value"
      }
    },
    {
      "id": "phq9_q9",
      "text": "Thoughts that you would be better off dead, or of hurting yourself",
      "response_format": {
        "type": "scale",
        "scale": "likert_0_3",
        "response_key": "value"
      }
    },
    {
      "id": "phq9_q10",
      "text": "If you checked off any problems, how difficult have these problems made it for you to do your work, take care of things at home, or get along with other people?",
      "response_format": {
        "type": "scale",
        "scale": "functional_difficulty_0_3",
        "response_key": "value"
      }
    }
  ],
  "metadata": {
    "estimated_time_minutes": 3,
    "clinical_use": true,
    "license": "Copyright © 1999 Pfizer Inc. Reproduced with permission"
  }
}