{
  "id": "k10",
  "name": "Kessler Psychological Distress Scale",
  "short_name": "K10",
  "category": "psychological_distress",
  "description": "A 10-item self-report questionnaire designed to yield a global measure of psychological distress based on anxiety and depressive symptoms experienced over the past 4 weeks.",
  "version": "10-item",
  "source": "Kessler et al. (2002), Harvard Medical School",
  "instructions": "These questions concern how you have been feeling over the past 30 days. For each question, select the option that best describes how often you felt that way.",
  "questions": [
    {
      "id": "k10_q1",
      "text": "During the last 30 days, about how often did you feel tired out for no good reason?",
      "response_format": {
        "type": "scale",
        "scale": "likert_1_5",
        "response_key": "value"
      }
    },
    {
      "id": "k10_q2",
      "text": "During the last 30 days, about how often did you feel nervous?",
      "response_format": {
        "type": "scale",
        "scale": "likert_1_5",
        "response_key": "value"
      }
    },
    {
      "id": "k10_q3",
      "text": "During the last 30 days, about how often did you feel so nervous that nothing could calm you down?",
      "response_format": {
        "type": "scale",
        "scale": "likert_1_5",
        "response_key": "value"
      }
    },
    {
      "id": "k10_q4",
      "text": "During the last 30 days, about how often did you feel hopeless?",
      "response_format": {
        "type": "scale",
        "scale": "likert_1_5",
        "response_key": "value"
      }
    },
    {
      "id": "k10_q5",
      "text": "During the last 30 days, about how often did you feel restless or fidgety?",
      "response_format": {
        "type": "scale",
        "scale": "likert_1_5",
        "response_key": "value"
      }
    },
    {
      "id": "k10_q6",
      "text": "During the last 30 days, about how often did you feel so restless you could not sit still?",
      "response_format": {
        "type": "scale",
        "scale": "likert_1_5",
        "response_key": "value"
      }
    },
    {
      "id": "k10_q7",
      "text": "During the last 30 days, about how often did you feel depressed?",
      "response_format": {
        "type": "scale",
        "scale": "likert_1_5",
        "response_key": "value"
      }
    },
    {
      "id": "k10_q8",
      "text": "During the last 30 days, about how often did you feel that everything was an effort?",
      "response_format": {
        "type": "scale",
        "scale": "likert_1_5",
        "response_key": "value"
      }
    },
    {
      "id": "k10_q9",
      "text": "During the last 30 days, about how often did you feel so sad that nothing could cheer you up?",
      "response_format": {
        "type": "scale",
        "scale": "likert_1_5",
        "response_key": "value"
      }
    },
    {
      "id": "k10_q10",
      "text": "During the last 30 days, about how often did you feel worthless?",
      "response_format": {
        "type": "scale",
        "scale": "likert_1_5",
        "response_key": "value"
      }
    }
  ],
  "metadata": {
    "estimated_time_minutes": 3,
    "clinical_use": true,
    "license": "Free for clinical and research use"
  }
}